{
  "version": "diagnostics/v1",
  "command": "check",
  "ok": false,
  "diagnostics": [
    {
      "code": "NQ-TYPE-042",
      "category": "TYPE",
      "severity": "error",
      "message": "annotated local initializer does not match declared type",
      "span": {
        "path": "tests/fixtures/m53_values/diagnostics_type_utf8.nq",
        "start": { "offset": 59, "line": 2, "column": 41 },
        "end": { "offset": 64, "line": 2, "column": 46 }
      },
      "notes": [],
      "help": null,
      "rendered": "tests/fixtures/m53_values/diagnostics_type_utf8.nq:2:41: TYPE[NQ-TYPE-042]: annotated local initializer does not match declared type"
    }
  ]
}
