{
  "version": "diagnostics/v1",
  "command": "check",
  "ok": true,
  "diagnostics": [
    {
      "code": "NQ-CONTRACT-001",
      "category": "CONTRACT",
      "severity": "warning",
      "message": "public function `helper` is missing an `audit` block",
      "span": {
        "path": "<SOURCE>",
        "start": {
          "offset": 4,
          "line": 1,
          "column": 5
        },
        "end": {
          "offset": 40,
          "line": 3,
          "column": 2
        }
      },
      "notes": [],
      "help": "Add `audit { intent(...); mutates(...); effects(...); }` before the function body.",
      "rendered": "warning[NQ-CONTRACT-001]: public function `helper` is missing an `audit` block\n  --> <SOURCE>:1:5\n   | pub fn helper() -> i32 {\n   |     ^^^^^^^^^^^^^^^^^^^^^^^^^^^^^^^^^^^^\n  help: Add `audit { intent(...); mutates(...); effects(...); }` before the function body."
    }
  ]
}
