{
  "version": "diagnostics/v1",
  "command": "check",
  "ok": true,
  "diagnostics": [
    {
      "code": "NQ-CONTRACT-001",
      "category": "CONTRACT",
      "severity": "warning",
      "message": "public function `helper` is missing an `audit` block",
      "span": {
        "path": "tests/fixtures/diagnostics_warning.nq",
        "start": { "offset": 7, "line": 1, "column": 8 },
        "end": { "offset": 13, "line": 1, "column": 14 }
      },
      "notes": [],
      "help": "Add `audit { intent(...); mutates(...); effects(...); }` before the function body.",
      "rendered": "tests/fixtures/diagnostics_warning.nq:1:8: CONTRACT[NQ-CONTRACT-001]: public function `helper` is missing an `audit` block"
    }
  ]
}
